phrase,connotation
Il se montre ingrat.,0
Elle ignore les émotions des autres.,0
Il se comporte de manière immature.,0
Elle ne respecte jamais les délais.,0
Il agit de manière imprudente.,0
Elle est trop difficile.,0
Il provoque des disputes.,0
Elle ne fait jamais d’efforts.,0
Il affirme des choses fausses.,0
Elle parle de façon blessante.,0
Il se ferme aux idées.,0
Elle ne cherche jamais à comprendre.,0
Il est très paresseux.,0
Elle amplifie tout.,0
Il n'écoute jamais vraiment.,0
Elle refuse toute aide.,0
Il se montre trop distant.,0
Elle trouve toujours quelque chose à critiquer.,0
Il dévalorise le travail commun.,0
Elle est constamment anxieuse.,0
Il agit sans logique.,0
Elle n’a aucune patience.,0
Il met les autres mal à l’aise.,0
Elle fait preuve de médisance.,0
Il exagère les faits.,0
Elle ne prend jamais rien au sérieux.,0
Il complique chaque tâche.,0
Elle provoque la gêne.,0
Il ne veut jamais participer.,0
Elle se montre très hautaine.,0
Il ne met aucune limite.,0
Elle dénigre les succès d’autrui.,0
Il rejette toute forme de critique.,0
Elle dramatise sans cesse.,0
